source,title,date,link,content
LAI_공지,[취업/알바/설명회] 무료/선착순 Live 취업 특강(9/04) - 4차 산업 교육 플랫폼 메타코드,2024.09.03,https://langai.hufs.ac.kr/bbs/langai/2090/176378/artclView.do,"국내 Top 대기업 현직자의 Live 특강 ※ 특강 구성 - AI 엔지니어가 하는 일 - 취업을 위한 준비(서류/코테/면접) - 뛰어난 현직자들이 가지고 있는 역량과 습관 - 나는 과연 실력있는 AI 엔지니어일까? - 실시간 Q&A 무료, 선착순 300명 마감 예정 (9.04) 이전의 특강 내용들과 최대한 겹치지않게, 새로운 트렌드 내용들을 추가 하고 있습니다! 관심있다면, 바로 신청하세요! https://metacodes.co.kr/edu/read2.nx?M2_IDX=30787&page=1&sc_is_discount=&sc_is_new=&EP_IDX=12194&EM_IDX=12018"
LAI_공지,[취업/알바/설명회] 2024~2025 GDSC HUFS Member 모집 공고 (~9/6),2024.09.03,https://langai.hufs.ac.kr/bbs/langai/2090/176367/artclView.do,"GDSC 한국외대가 무엇인가요? Google Developer Student Clubs (GDSC) 커뮤니티는 학생들이 글로벌 구글 프로그램에 참여하며 개발 능력을 키우고 고용가능성을 증대시키도록 돕는 프로그램입니다. GDSC 한국외대는 한국외국어대학교에서 진행되는 GDSC 챕터로, 한국외국어대학교에서 가장 활발하게 움직이는 개발자 커뮤니티입니다. 우리는 개발자로서 성장하며 남기는 기록들을 공유하는 것을 중시하며, 이를 통해 모든 구성원이 함께 발전할 수 있는 강력한 네트워크를 구축하고 있습니다. 어떤 활동들을 하게 되나요? GDSC 한국외대 6기는 2024년 9월부터 2025년 7월까지 운영됩니다. GDSC 한국외대의 Member 는 다음과 같은 활동들에 참여하게 됩니다. [스터디 및 프로젝트] 지난해 GDSC 한국외대에서는 Spring, Flutter, AI 스터디를 진행하고 이를 기반으로 GDSC Solution Challenge에 참가했습니다. 올해도 지원자분들이 선호하는 학습 분야와 원활한 프로젝트 진행을 위한 스터디 방향을 종합적으로 고려하여 선정된 3-4가지 분야에서 올 가을학기, 내년 봄 학기에 스터디를 진행합니다. [매주 진행되는 정기 세션] 매주 다른 멤버들의 이야기를 들을 수 있는 정기 세션은 다른 개발자 동아리에서는 찾아볼 수 없는 GDSC 한국외대의 독특한 프로그램입니다. 자유로운 주제를 선정하여 멤버들에게 자신의 이야기를 나누고 그 안에서 다양한 인사이트를 얻을 수 있습니다. [이 밖의 다른 행사들] GDSC 한국외대는 매년 교내 알고리즘 대회, 일일 커밋 프로그램, 교내 해커톤, 세미나 등 다채로운 활동들을 운영하며 교내 개발자 네트워크 활성화에 힘쓰고 있습니다. GDSC 한국외대에 참여해서 다양한 교내의 개발자 네트워킹 행사는 물론, 다른 학교에서 전개되는 GDSC 챕터와 공동으로 개최되는 이벤트 및 네트워킹 행사에 참여해 보세요. 지원 자격 한국외국어대학교 소속 재학생/휴학생 (캠퍼스 및 전공 불문) 2025년 7월까지 GDSC 한국외대 활동에 원활하게 참여가능한 자 이런 분들을 모집하고 있습니다. 지식을 나누는 일에 거리낌이 없으신 분 프로그래밍에 대한 전반적이고 기본적인 지식이 있으신 분 스스로 공부하며 다른 분들과 함께 성장하는 것을 좋아하시는 분 활동 관련 유의 사항 주 1회 온라인 정기 세션이 매주 화요일 오후 9시부터 90분 가량 진행됩니다. 월 1회 대면 정기 세션이 평일 오후 6시경 서울캠퍼스/글로벌캠퍼스에서 각각 이루어집니다. 시간과 요일은 변동될 수 있으며 사정에 의해 비대면으로 전환되어 진행될 수 있습니다. (분기마다 진행되는 오프라인 세션의 경우 양 캠퍼스 중 한 장소 혹은 외부 장소를 대관하여 이루어집니다) GDSC 멤버로 활동하실 경우 매주 진행되는 세션과 매월 진행되는 오프라인 행사에 적극적으로 참여하셔야 합니다. 행사의 과반 이상을 참여하여야 멤버로 수료가 가능하며, 활동 기간 중 진행되는 스터디 및 프로젝트는 필수 참여 요건입니다. 서류 접수 기간 2024년 8월 26일(월) 10:00 ~ 2024년 9월 6일(금) 23:59 ※ 자세한 모집 일정은 웹사이트 모집 공고를 참고하시기 바랍니다. 지원방법 https://www.gdschufs.com 에서 지원공고 확인 및 모집 관련 Q&A 오픈채팅방: https://open.kakao.com/o/sEShP6Kg"
LAI_공지,[취업/알바/설명회] ZEN AI 2024 : 트렌드를 이끄는 AI 컨퍼런스 (9/12~13),2024.08.26,https://langai.hufs.ac.kr/bbs/langai/2090/175644/artclView.do,"한국외국어대학교 학생분들을 AI 분야의 혁신과 발전을 함께하는 ZEN AI 2024 : 트렌드를 이끄는 AI 컨퍼런스에 초대드립니다. ZEN AI 2024는 다양한 기업과 현직 전문가들이 한 자리에 모여, AI의 미래를 열어가는 최신 기술과 실무 적용 사례를 깊이 있게 다루는 행사입니다. 한국외국어대학교 전용 80% 할인 쿠폰 (할인 적용 시, 양일권 1매 가격 6만원)을 제공하여 학생들이 이번 AI 컨퍼런스에 부담 없이 참여할 수 있도록 하고자 합니다. 이 쿠폰은 한국외국어대학교 학생들만을 위한 특별한 혜택으로, 학생들이 최신 AI 트렌드를 학습하고, 전문가들과의 네트워킹 기회를 놓치지 않도록 지원해 드리려고 합니다. [행사 개요] - 행사명: ZEN AI 2024 - 일시: 9월 12일(목) - 13일(금), 오전 11시 - 오후 4시 - 형식: ZEP (온라인으로 진행) - 연사: 미드저니, 텐센트 클라우드, 비즈매트릭스, 셀렉트스타 등 - 주요 주제: 최신 AI 기술 동향, 산업 적용 사례, LLM 신뢰성 검증 등 더 자세한 연사 세션 트랙은 아래 이미지를 참고해주세요. 해당 행사에 관심 있는 학생은 학부사무실(내선 2278)로 연락주시기 바랍니다."
LAI_공지,[취업/알바/설명회] [메타코드] 4차 산업 교육 플랫폼 메타코드,2024.08.16,https://langai.hufs.ac.kr/bbs/langai/2090/169200/artclView.do,"AI 시대, 개발자 생존 비결 알려줄게! 네카라쿠배, 10년 차 현직자의 Live 커리어 특강 무료, 선착순 200명 마감 예정 (8.19) 개발자 경력 확장 로드맵(Backend/DevOps) AI 분야 발전에 따른 개발 직무의 미래 AI 시대, 경쟁력을 갖추기 위한 공부 노하우 이전의 특강 내용들과 최대한 겹치지않게, 새로운 트렌드 내용들을 추가 하고 있습니다.! 관심있다면, 바로 신청하세요! https://metacodes.co.kr/edu/read2.nx?M2_IDX=30787&page=1&sc_is_discount=&sc_is_new=&EP_IDX=11990&EM_IDX=11814"
LAI_공지,[취업/알바/설명회] [메타코드] 4차 산업 교육 플랫폼 메타코드,2024.08.12,https://langai.hufs.ac.kr/bbs/langai/2090/167325/artclView.do,"Data Scientist 문과생이 직무 전환할 때 알아야 할 꿀팁들 문과 출신의 대기업 5년차 현직자가 알려주는 노하우 듣고 가세요! 선착순 300명으 무료 마감 예정 (8.13) 문과 출신 멘토의 직무 전환 성장 과정 공개 멘토님만의 서류/면접/코테 대비 방법 공개 이전의 특강 내용들과 최대한 겹치지않게, 새로운 트렌드 내용들을 추가 하고 있습니다.! 관심있다면, 바로 신청하세요! https://metacodes.co.kr/edu/read2.nx?M2_IDX=30787&page=1&sc_is_discount=&sc_is_new=&EP_IDX=11697&EM_IDX=11521"
LAI_공지,[취업/알바/설명회] [메타코드] 4차 산업 교육 플랫폼 메타코드,2024.08.07,https://langai.hufs.ac.kr/bbs/langai/2090/167117/artclView.do,국내 => 미국 Data Engineer 이직 절대 늦지 않았다! <20년차 미국 AWS Data Engineer>가 알려주는 무료 해외 취업 특강! (1) 국내에서 10년이상된 개발자가 -> 미국 AWS 시니어 데이터 엔지니어로 재직 중 (2) 개발자에서 데이터 엔지니어로 커리어 전환할 수 있었던 비결 공개! (3) 미국 학위 없이 커리어 점프를 만들어 낼 수 있었던 노하우 공개! 미국 학위 없는 미국 AWS의 시니어 Data Engineer 현직자분의 <커리어 특강>에 초대합니다 진행 일정 (한국시간 기준) 8.10(토) 오전 11시 강사님은 어떤 분이죠? - 한국에서 10년이상 개발자 경력이 있으신 분 - (현) 미국 AWS 이런분에게 특강 추천드려요! (1) 미국 빅테크 취업/이직이 궁금하다면? (2) 미국 학위 없이 미국 개발자 취업을 계획하시는 분들! (3) 주니어 개발자 시기에 맞게 어떤 역량/스펙을 키워야하는지 궁금한 분들 무료 3초만에 신청 https://www.metacodes.co.kr/edu/read2.nx?M2_IDX=30787&EP_IDX=11412&EM_IDX=11236
LAI_공지,[취업/알바/설명회] [취업/알바/설명회] [멀티캠퍼스] 24년 8~9월 IT국비지원교육 교육과정 신청안내,2024.08.06,https://langai.hufs.ac.kr/bbs/langai/2090/167093/artclView.do,"안녕하십니까, 연락드리는 곳은 삼성그룹 교육전문기업 멀티캠퍼스라고 합니다. 멀티캠퍼스에서는 매월 SW개발자 및 데이터 전문가를 꿈꾸는 취업준비생을 대상으로 무료 IT교육을 제공하고 있습니다. SW개발자 취업을 희망하지만 프로젝트 경험 및 포트폴리오 준비가 부족한 IT전공생, IT전공은 아니지만 SW개발자로의 삶을 꿈꾸는 IT 비전공생, 취업을 위해 데이터분석 스펙을 쌓고자하는 취업준비생 등 다양한 취업준비생들의 Needs에 맞춰 24년 8월과 9월에 교육이 시작되는 ""멀티캠퍼스의 K-디지털트레이닝 교육과정""인 멀티잇 교육일정에 대해 안내드리고자 합니다. 해당 교육과정은 전액무료(국비)로 수강 할 수 있으며, 멀티캠퍼스이 멀티잇 교육과정 수강생은 IT교육부터 취업지원서비스까지 무상으로 제공받으실 수 있습니다. 대상: 대학 재(휴)학생 및 졸업생 감사합니다. [24년 8~9월 멀티잇 교육과정 일정안내] 24년 8~9월 교육일정 자세히보기: https://bit.ly/3Y2FsM5 1. [빅데이터] 데이터 분석&프롬프트 엔지니어링(파이썬) 과정소개: Python기반 데이터분석부터 생성형AI활용 프롬프트 엔지니어링 교육진행 교육기간: 2024.08.01 ~ 2024.12.27 / 2024.09.09 ~ 2025.02.18 2. [빅데이터] 데이터 분석가 부트캠프(파이썬) 과정소개: 금융/마케팅/공공 데이터 분석, Python 및 통계기초부터 자연어처리학습 교육기간: 2024.08.26 ~ 2025.02.13 3. [풀스택] 채용연계 풀스택개발(Java) 과정소개: 교육부터 현장 OJT를 한번에! Java 기반 SW개발 풀스택 학습 교육기간: 2024.09.02 ~ 2025.03.03 4. [빅데이터] 데이터 분석&엔지니어(파이썬) 과정소개: 데이터 사이언스부터 데이터 엔지니어링까지, 데이터 엔지니어에 특화된 빅데이터과정 교육기간: 2024.09.09 ~ 2025.03.12 5. [프론트엔드] 프론트엔드 개발(React) 과정소개: 사용자 UI 구축 및 기능구현, 프론트엔드 전문가 양성을 위한 UX/UI 및 React/Vue 교육진행 교육기간: 2024.09.09 ~ 2025.02.12 6. [백엔드] 백엔드 개발자 부트캠프(스프링) 과정소개: 웹 기반 서비스와 플랫폼 구축, 채용시장 수요1위 Java개발자 양성 교육기간: 2024.09.23 ~ 2025.01.30"
LAI_공지,[취업/알바/설명회] [메타코드] 4차 산업 교육 플랫폼 메타코드,2024.08.06,https://langai.hufs.ac.kr/bbs/langai/2090/167072/artclView.do,"Data Analyst 취업의 오해와 진실... 네카라쿠배 6년 차 현직자 특강에 초대합니다 선착순 300명을 무료 마감 예정 (8.8) 취업에 대해 흔히 하는 고민들과 오해 멘토님만의 데이터 분석 취업 꿀팁(공부법/채용 준비) 채용 공고를 분석 할 때 반드시 알아야 할 것들 최근 데이터분석가 취업 현황/커리어 이직 비결 이전의 특강 내용들과 최대한 겹치지않게, 새로운 트렌드 내용들을 추가 하고 있습니다.! 관심있다면, 바로 신청하세요! https://www.metacodes.co.kr/edu/read2.nx?M2_IDX=30787&page=1&sc_is_discount=&sc_is_new=&EP_IDX=11556&EM_IDX=11380"
LAI_공지,[일반공지] 한국외국어대학교 반도체 부트캠프 사업 관련 공지,2024.08.02,https://langai.hufs.ac.kr/bbs/langai/2090/166929/artclView.do,"안녕하세요, Language&AI융합학부 여러분, 한국외국어대학교가 첨단산업 인력양성 정부지원사업에 선정되었습니다! 이에 따라 2024학년도 2학기부터 2029학년도 1학기까지 총 5년간 반도체 부트캠프 사업을 수행합니다. 본 사업은 4대 분야(AI, 영상, 통신, 바이오)에서 시스템반도체 전문 설계 인력 양성을 목표로 하며, 집중 몰입 교육 및 연계 학위 과정을 운영합니다. 반도체에 관심 있는 모든 학과 학생들이 참여할 수 있으며, 특히 AI융합대학 학생들은 협력학과로 더 적극적인 협조가 가능합니다. 학생 모집은 총 3단계(Level 1, 2, 3)로 진행되며, 4가지 교육 프로그램이 포함됩니다. (PDF 참고) Language&AI융합학부 학생들에게는 Level 1인 ""시스템반도체 기초"" 과정(2과목 구성)이 적합해 보입니다. 조금 더 전문적인 학습을 원한다면 Level 2인 ""시스템반도체 기본"" 과정(3과목 구성)을 수강할 수 있습니다. 1개 이상의 교육 프로그램을 이수하면 부트캠프 양성 인력에 포함되며, 마이크로전공(12학점), 부전공(21학점), 이중전공(42학점), 전공심화(63학점) 학위와 연계됩니다. 이는 졸업장 및 성적증명서에 표기될 수 있도록 교무처와 협의 중입니다. 또한 참여하는 학생들에게는 장학금(금액과 자격은 내규 마련 중) 및 외부 기관(ETRI 등) 교육비 등의 지원이 제공됩니다. 2024학년도 2학기에는 시간표가 확정된 후 부트캠프 선정이 되어 글로벌캠퍼스에서만 강의가 개설될 예정입니다. 2차년도(2025년)부터는 학생 수요에 따라 서울캠퍼스 강의 개설을 논의할 예정입니다. 추가적인 자료는 첨부된 PDF에서 확인할 수 있습니다. 2024학년 2학기에 많은 관심 바랍니다. 감사합니다."
LAI_공지,[취업/알바/설명회] [메타코드] 미국 스타트업 4년차 현직자 개발자 취업 특강,2024.07.31,https://langai.hufs.ac.kr/bbs/langai/2090/166856/artclView.do,"미국 취업은 아래 케이스들로 다양한 루트를 참고하실 수 있습니다. (1) 20대 중반, 한국 지방대 학생이 30대 중반 미국 Microsoft 개발자 되신분 (2) 20대 후반 한국 개발자가 -> 해외 Google 지사 개발자 이직하신분 (3) 30대 중반까지 한국에 계시다가, 40대쯤 미국 AWS 이직하신분 (4) 한국에서 대학교 나오고, 미국 석사를 통해 미국 개발자가 되신분 (5) 한국 사무실의 미국 스타트업 멤버로 일하다가, 현재 미국 현지에서 일하시는분 (6) 한국 -> 캐나다 -> 미국, 이직 커리어 쌓아오신분 Microsoft 출신, 60조 기업 미국 1위 딜리버리 스타트업 ""도어대시"" 현직자분의 <커리어 특강>에 초대합니다 진행 일정 (한국시간 기준) 8.4(일) 오전 11시 강사님은 어떤 분이죠? - 신입때 스타트업 포함 10곳을 모두 합격하신분 - (전) 마이크로소프트 - (현) 도어대시 이직 예정 이런분에게 특강 추천드려요! (1) 미국 스타트업 취업/이직이 궁금하다면? (2) 미국 석사를 통해, 미국 개발자 취업을 계획하시는 분들! (3) 대학교 / 주니어때 시기에 맞게 어떤 역량/스펙을 키워야하는지 궁금한 분들 무료 3초만에 신청 https://metacodes.co.kr/edu/read2.nx?EP_IDX=11481&EM_IDX=11305&M2_IDX=30787"
LAI_공지,[일반공지] [필독] 24-2학기 수강신청 안내,2024.07.30,https://langai.hufs.ac.kr/bbs/langai/2090/166832/artclView.do,"24-2학기 전공필수과목 - Language&AI개론(3학점), 확률과통계(3학점), AI윤리(2학점) 1. 24-2학기 수강신청 일정 및 과목 안내 일정: 8.5(월) ~ 8.9(금) 10시~15시 (4학년: 8/5(월), 3학년: 8/6(화), 2학년: 8/7(수), 1학년: 8/8(목), 전체 학년: 8/9(금) 10시~15시에 신청) 공통 모든 전공 수업은 수강신청 기간에 1전공 우선수강을 원칙으로 함. (전공) Language&AI개론 - Language&AI 융합학부 전공필수과목 - 8월 중 담당교수 입력 예정 확률과 통계 - Language&AI 융합학부 전공필수과목 - Social Science&AI 융합학부와 공통 운영 - (중요!!) Social Science&AI 융합학부에서 열리는 과목으로 Language&AI융합학부 전공 페이지에서는 선택 불가 반드시 Social Science&AI 융합학부 전공 페이지에서 수강신청 - 8월 중 담당교수 입력 예정 AI 윤리 - Language&AI 융합학부 전공필수과목 - Social Science&AI 융합학부와 공통 운영 - (중요!!) Language&AI 융합학부에서 열리는 과목으로 Social Science&AI융합학부 전공 페이지에서는 선택 불가 반드시 Language&AI 융합학부 전공 페이지에서 수강신청 객체지향프로그래밍 - Language&AI 융합학부 전공선택과목 - 8월 중 담당교수 입력 예정 (교양) 졸업요건: 최소 35학점 이수 기타 사항은 학교 홈페이지 HOTLINK '2024학년도 2학기 수강편람(서울)' 26. 27페이지 참고. 미네르바인문(2) - Language&AI 융합학부 교양필수과목 소프트웨어기초 - 전 학년 동안 1과목 이상 필수로 이수해야 함. (최소 총 3학점) 핵심인문기초 - 전 학년 동안 1과목 이상 필수로 이수해야 함. (최소 총 2학점) English for HASS(인문) 또는 English for STEM(자연) - Language&AI 융합학부 교양필수과목 English Writing for HASS(인문) 또는 English Writing for STEM(자연) - Language&AI 융합학부 교양필수과목 인공지능을위한기초수학 - 과학과기술 교양 과목 - Language&AI 융합학부/Social Science&AI 융합학부 우선 수강 과목 - 수강 신청기간에만 우선 수강 과목으로 지정, 수강 변경기간에는 다른 학과 학생도 신청 가능하니 반드시 수강신청 기간에 신청 2. 증원 관련 - 증원은 수강 희망 강좌를 담당하는 교수님에게 메일로 요청. (메일주소는 강의계획서에 기재되어 있음.) - 증원은 개별 과목 담당 교수님의 의사에 따라 강의실의 수용정원까지 가능. 3. 수강신청 변경 9.2(월)~9.6(금) 10시~17시 - 단, 취소는 1~4일차 22시까지, 5일차는 17시까지 가능. 4. 수강신청 취소 9.23(월)~9.27(금), 매일 10시~22시 - 12학점 미만으로 취소 불가. - 취소 후 반드시 취소 결과를 확인할 것. 기타 문의 사항은 메일(hufs_langai@hufs.ac.kr) 또는 내선번호 2278로 문의 바랍니다."
LAI_공지,[취업/알바/설명회] [TYS2024] 한일중 청년 모의 정상회의 방청단 모집 안내,2024.07.30,https://langai.hufs.ac.kr/bbs/langai/2090/166784/artclView.do,"[TYS2024 Observer Invitation] Inviting observers for ROK-Japan-China Trilateral Youth Summit 2024 We would like to invite you as the observer of the ROK-Japan-China Trilateral Youth Summit 2024 (TYS2024), held at HUFS on August 9th. We would appreciate your interest and participation. Event Details - Venue: Obama Hall, Minerva Complex @HUFS - Date: August 9 (Fri), 14:00-16:20 - Dress Code: Business Casual Application link: https://forms.gle/tPQYiH1Wxk2YcEAGA"
LAI_공지,[취업/알바/설명회] [메타코드] Microsoft 백엔드 현직자 미국 취업 특강 (07.28),2024.07.25,https://langai.hufs.ac.kr/bbs/langai/2090/166623/artclView.do,"메타코드에서는 미국 Top IT기업 백엔드 현직자분들을 매주 1회씩 모셔서, <취업/이직 커리어 특강>을 무료로 Live 진행하고 있습니다. 멘토님들의 경우 해외대 출신분도 계시고, 한국에서 이직하신분도 계시기 때문에 다양한 케이스에 대해서 정보 도움 받으실 수 있습니다. [ 7.28] 5년차 미국 마이크로소프트 개발자 <취업 특강> 초대합니다 진행 일정 (한국시간 기준) 7.28(일) 오전 11시 강사님은 어떤 분이죠? 마이크로소프트에서 채용도 10명정도 진행해보셔서, 실제 어떤 부분을 채용시 중요하게 보는지 알려드립니다. 이런분들에게 특히~ 추천드려요! (1) 해외대 출신이고 영주권이 없기에, 해외 취업이 매우 중요하신분 (2) 미국 Top IT기업 채용시장이 궁금하신분? (3) 대학생때, 어떤 프로젝트 만들며 준비해야하나요? (4) 주니어 개발자로서, 어떻게 준비해야 이직 성공하나요? (5) 이력서, 면접 준비는 어떻게 하면 좋을지? [ 무료로 - 3초만에 신청하러 가기] https://metacodes.co.kr/edu/read2.nx?M2_IDX=30787&page=1&sc_is_discount=&sc_is_new=&EP_IDX=10193&EM_IDX=10017"
LAI_공지,[취업/알바/설명회] [멀티캠퍼스] 24년 2차 공유/개방 무료교육과정 신청,2024.07.24,https://langai.hufs.ac.kr/bbs/langai/2090/166600/artclView.do,"⊙ K-하이테크 플랫폼 멀티캠퍼스 24년 2차 공유/개방 무료교육과정 신청 누구나 무료로 들을 수 있고, 집에서 수강할 수 있는 IT 비대면 라이브 교육 지금 신청하세요! ★ 교육신청하기 : https://forms.gle/z92TU7fEBPMkpgBk9 참가비 : 전액 무료 교육 대상 : 교육 의지가 있는 누.구.나 교육 방식 : 비대면 수업 (신청 이후 ZOOM 링크 별도안내) 과정 소개 ※ 아래 과정 중 선택 (중복 신청 가능) [과정 1] IT 비전공자를 위한 데이터 시각화 (feat. Power BI) 교육 일시 8/12(월) ~ 8/13(화), 09:00 ~ 18:00 학습 대상 ① 데이터를 손쉽게 시각화하여 유용한 비즈니스 인사이트를 얻고자 하시는 분 ② Power BI를 이용한 데이터 시각화에 관심 있는 분 ③ 다양한 형태의 대규모 데이터를 엑셀로 다루면서 한계를 느끼는 분 학습 내용 ① Power BI를 활용한 데이터 분석 및 보고서 작성 자동화 ② 데이터 분석을 위한 전처리에서부터 데이터 시각화까지의 흐름 이해 교육 자세히 보기 https://blog.naver.com/multicampus_it/223362977832 [과정 2] 챗 GPT 파이썬 프로그래밍 교육 일시 8/23(금), 09:30 ~ 17:30 학습 대상 ① 최소한 파이썬 언어의 문법을 알아야 수업을 들을 수 있습니다. ② 파이썬의 다양한 라이브러리(BeautifulSoup, Pandas, Numpy, matplotlib)를 사용해 본 경험이 있으면 도움이 됩니다. ③ 1인 개발자로써 생산성 향상에 관심이 있는 개발자, 엔지니어들을 대상으로 합니다. 학습 내용 ① ChatGPT를 사용해서 기본적인 코드를 생성해서 활용하는 방법을 학습합니다. ② 생성형AI엔진에 익숙하지 않은 개발자들도 프롬프트를 사용해서 코드, 텍스트, 이미지등을 생성할 수 있습니다. ③ 파이썬의 크롤링코드, 기존 코드를 수정하는 방법, 코드에 자동으로 주석을 추가하는 방법들을 학습합니다. 교육 자세히 보기 https://blog.naver.com/multicampus_it/223365497219 ★ 교육신청하기 : https://forms.gle/z92TU7fEBPMkpgBk9"
LAI_공지,[취업/알바/설명회] [선착순 300명] 비전공자 출신 Data Engineer 현직자 특강 (07.25),2024.07.23,https://langai.hufs.ac.kr/bbs/langai/2090/166592/artclView.do,"선착순 300명을 무료로 위 취업특강에 초대합니다! ‍데이터 엔지니어로 진로를 결정한 이유 ‍중소 스타트업부터 ~ 대기업 모두 경험 ‍커리어 준비 / 이직 스토리 + 노하우 공개 ‍서류 / 코테 / 면접 대비전략 이전의 특강 내용들과 최대한 겹치지않게, 새로운 트렌드 내용들을 추가 하고 있습니다.! 관심있다면, 바로 신청하세요! https://metacodes.co.kr/edu/read2.nx?M2_IDX=30787&page=1&sc_is_discount=&sc_is_new=&EP_IDX=10274&EM_IDX=10098"
LAI_공지,[취업/알바/설명회] [멀티캠퍼스] 백엔드 개발자 부트캠프(스프링) 교육안내,2024.07.17,https://langai.hufs.ac.kr/bbs/langai/2090/160973/artclView.do,"1. 교육일정: 2024.07.29(월) ~ 2024.12.17(화) 2. 교육소개: 웹 기반 서비스와 플랫폼 구축, 채용시장 수요 1위 Java개발자 양성 3. 자세히보기: https://bit.ly/456cVq9"
LAI_공지,[취업/알바/설명회] [선착순 300명] SK Data Scientist 현직자 Live 취업 특강,2024.07.15,https://langai.hufs.ac.kr/bbs/langai/2090/160877/artclView.do,<특강 내용> 1. 데이터 사이언티스트의 핵심 역량 소개 2. 직무 코어 스킬 향상을 위한 비법 공개 3. 비지니스 인사이트를 얻는 방법들 => 그에 따른 데이터 사이언티트스가 되기 위한 로드맵 제시 <특강 일시> 24.07.16 화요일 pm 8:00~9:00 <특강 신청하기(클릭)>
