source,title,date,link,content
LAI_공지,[취업/알바/설명회] [메타코드] 퍼포먼스 마케팅 실무 챌린지 1기 모집 (전액 무료),2025.07.30,https://langai.hufs.ac.kr/bbs/langai/2090/232831/artclView.do,"안녕하세요. Language&AI융합학부 사무실입니다. 메타코드 퍼포먼스 마케팅 실무 챌린지 1기 모집 안내 드립니다. 안녕하세요, AI 및 디지털 실무교육 플랫폼 메타코드입니다. 최근 기업에서는 전공과 관계없이, 데이터 기반 퍼포먼스 마케팅 역량을 갖춘 인재를 선호하고 있습니다. 특히 커머스, 스타트업, 대기업 마케팅 직무뿐 아니라 기획, CRM, 브랜드, 콘텐츠, 운영 직무에서도 퍼포먼스 마케팅 실무 경험을 매우 중요하게 평가하고 있습니다. 이에, 대학생들이 현업에서 바로 활용 가능한 실무 경험을 쌓을 수 있도록 [퍼포먼스 마케팅 일잘러 챌린지 1기] 프로그램을 전액 무료로 제공하고자 합니다. 이번 챌린지는 실제 대기업 마케터들이 집필한 30시간 분량의 실무형 온라인 과정으로, 직무 이해 → 툴 실습 → 캠페인 운영 이해 → 성과 측정 및 리포트 작성까지 실제 채용에 도움이 되는 내용을 담고 있습니다. ======================================================= [무료 / 선착순 200명 모집 / 직장인, 대학생] 퍼포먼스 마케팅 일잘러 챌린지 1기 (8.9 시작) 감으로 하는 마케팅 시대는 끝났습니다. 이제 데이터로 증명하는 [퍼포먼스 마케팅]을 배우세요. 퍼포먼스 마케팅은 광고비 대비 성과(ROI)를 실시간으로 측정하고 최적화할 수 있다는 장점이 있습니다. 모 대기업이 퍼포먼스 마케팅으로 온라인 쇼핑몰 유입을 100% 가까이 증가시키고, 매출을 300% 이상 증대시킨 사례도 있습니다. 대기업 현직자 출신 6인의 전문가가 제작한 최대 30시간 VOD 강의를 메타코드 회원분들을 위해서 전액 무료 제공해 드리고 있습니다. ️ 5초만에 신청하기 https://metacodes.co.kr/edu/read2.nx?EP_IDX=21769&EM_IDX=21579&M2_IDX=30103 ■ 참여 혜택 및 구성 - 실무에 바로 적용 가능한 마케팅 실습 강의 제공 - 총 30시간 강의 제공 - 온라인 5주 집중 과정 + 수료자 대상 오프라인 모임 참여 기회 제공 ■ 강사진 소개 - 7년차 대기업 마케팅 매니저 - 15년차 대기업 CRM 매니저 - 8년차 퍼포먼스 그로스 마케터 - 11년차 마케팅 에이전시 팀장 - 9년차 인하우스 마케팅 팀장 ■ 주요 커리큘럼 - 퍼포먼스 마케팅 기초의 모든 것(엑셀, 구글 시트 활용한 성과 리포팅) - 디지털 마케팅의 종류 및 AARRR(마케팅 성과 측정, CRM 마케팅, 사용자 여정과 퍼널) - 구글 애널리틱스(GA4)와 보고서 구성(GA4 필수 용어, 광고보고서 작성, GA4 이벤트 태그 설치) - 네이버, 메타 광고 세팅하기(네이버 DA, 네이버 SA,. 메타 DA 광고 세팅 프로세스) - 앱 마케팅 및 ASO 도구 활용(앱 트래킹 원리, Meta 앱 캠페인, Meta SDK) - CRM의 모든 것(CRM KPI, 고객 경험, 고객 여정 맵 이해하기, CRM 목표 설정) ■ 퍼포마 일잘러 1기 신청 절차 1단계) 사이트에서 무료 수강 신청 신청하기 링크 https://metacodes.co.kr/edu/read2.nx?EP_IDX=21769&EM_IDX=21579&M2_IDX=30103 2단계) 신청자에게 문자로 발송되는 구글폼 작성※ 두 단계 모두 완료 시 신청 확정 -- -- 4차 산업 핵심 직군 교육 / 채용 플랫폼 MetaCode M 메타코드M 사이트 메타코드M, AI 교육 플랫폼 런칭 1년 만에 누적 수강생 5만 명 돌파 메타코드M_Youtube"
LAI_공지,[취업/알바/설명회] [한국경제신문] CJ 올리브네트웍스와 함께하는 AX Wave 교육과정 소개,2025.07.30,https://langai.hufs.ac.kr/bbs/langai/2090/232792/artclView.do,"안녕하세요. Language&AI융합학부 사무실입니다. CJ올리브네트웍스 AX WAVE 교육과정 안내 드립니다. AX Wave 부트캠프 1기는 AI 시대 핵심 인재 양성을 위한 비전공자 특화 교육과정으로, CJ그룹의 실무 경험과 생성형 AI 기술을 결합하여 실전형 AI 서비스 기획자를 양성합니다. 이 과정은 모든 훈련 과정이 한국경제신문의 최신식 강의실에서 진행되며, 실습과 프로젝트 위주로 구성되어 있어 실전 포트폴리오를 제작할 수 있는 것이 특징입니다. 그리고 수강생들의 취업연계를 위해 수료 후 우수한 인재에 대해서는 CJ올리브네트웍스에서의 인턴십 기회 및 채용가산점도 진행할 예정입니다. [CJ올리브네트웍스] AX WAVE 부트캠프 알아보기 과정 개요 AI 시대 핵심 인재 양성을 위한 비전공자 특화 교육과정으로, CJ그룹의 실무 경험과 생성형 AI 기술을 결합하여 실전형 AI 서비스 기획자를 양성합니다. 모집 대상 교육 대상 *내일배움카드 소지 필수 비IT전공 2학년 이상 대학생 졸업예정자 및 기졸업생 교육 기간 2025년 9월 1일 ~ 2026년 2월 28일 총 960시간 (약 6개월) 평일(09:00-18:00) 집중 교육 교육과정 구성 DX Essential → DX Performance → AX Essential → AX Performance →최종 프로젝트 순으로 구성 DX Essential: Excel, SQL, PowerBI, GA 등 디지털 기초 도구 활용 DX Performance: 실무 기획서 작성, UX/UI 프로토타입, 노코딩 앱 구현 AX Essential: AI 기초 이론, 생성형 AI 활용, 프롬프트 엔지니어링 AX Performance: AI서비스 기획,RAG 시스템 구축, API 연동 최종 프로젝트: CJ 실무 데이터 기반 AI Chatbot 개발 예시: 자율주행 차량용 AI 기반 교통 데이터 분석, 생활법률상담 챗봇, XR 기반 가상 인테리어 설계 플랫폼 등 과정 특장점 CJ그룹 실제 AI 인프라 환경 동일 사용 - OneFlow 플랫폼 등 현업 도구 활용 우수 수료생 대상 CJ올리브네트웍스 인턴십 기회 제공 실무 멘토링: 올리브네트웍스 현업 담당자, AI 연구소 전문가 직접 지도 실전 프로젝트: CJ 계열사 실무 데이터를 활용한 현실적 과제 수행 교육비 지원 전액 무료 (정부 지원) 월 316,000원 훈련장려금 지급 *참여자 조건에 따라 상이 AI 관련 직무 취업 상담 및 연계"
LAI_공지,"[수업] 기초 과목('확률과 통계', 'AI윤리와철학', &ap",2025.07.29,https://langai.hufs.ac.kr/bbs/langai/2090/232783/artclView.do,"안녕하세요. Language&AI융합학부 사무실입니다. 기초 과목 중 '이공계열' 과목인 '확률과통계'(Q05004101, Q05004102), 'AI융합대학' 과목인 'AI윤리와철학'(Q01024101)과 '인공지능개론'(Q01026101, Q01026102)의 수강 신청 관련하여 공지 드립니다. 위 기초 과목들은 AI융합대학 소속 학생 우선 수강이 가능한 과목입니다. Language&AI융합학부 및 Social Science&AI융합학부 소속 학생은 각 학년 별 수강신청 기간인 8/4-8/7부터 위 과목들의 수강 신청이 가능하며, 본인 학년에 해당하는 수강신청일부터 수강 신청하실 수 있습니다. 반면, 타 학과(부) 소속 학생은 전체 학년 수강신청일인 8/8(금)부터 해당 기초 과목들의 수강신청이 가능합니다. * 예외적으로 자유전공학부생은 본인 학년에 해당하는 수강신청일부터 위 기초과목들의 수강신청이 가능합니다. (교내 수강 제한 관련 원칙에 따름) 그리고, '확률과통계', '인공지능개론'은 강의 시간표에서 Language&AI융합학부, Social Science&AI융합학부 강의가 분류되어 있습니다. 다만 수강신청 시스템상 각 학부 간 교차 수강신청이 제한되어 있지는 않으므로 참고 부탁드립니다. 아래 표 및 예비수강신청함을 참고해주세요. 감사합니다. 소속 '확률과통계', 'AI윤리와철학', '인공지능개론' 수강 신청이 가능한 날짜 LAI / SSAI / 자유전공학부 8/4(월)-8/7(목) 중 본인 학년에 해당하는 수강신청일 ~ 수강신청 마감 타 학과(부) 8/8(금) ~수강신청 마감 참고) 기초 과목 '확률과 통계', '인공지능개론' 에서 LAI, SSAI 교차 수강신청을 제한하지 않음."
LAI_공지,[취업/알바/설명회] 취업 역량을 강화시키는 <GPT 일잘러챌린지 9기 - 무료>,2025.07.28,https://langai.hufs.ac.kr/bbs/langai/2090/232640/artclView.do,"안녕하세요. Language&AI융합학부 사무실입니다. 청년취업사관학교 새싹(SeSAC) 커서AI 프론트엔드 부트캠프 교육생 모집 안내 드립니다. 대기업 취업할때 요즘 생성형 AI 활용 능력은 필수입니다. 메타코드에서 <국내 Top 대기업 직무별 현직자 8분을 모셔서, 50시간 촬영한 강의>입니다. [무료 / 선착순 30명 모집] ChatGPT활용 일잘러 챌린지 9기 ChatGPT 시대, 인재 경쟁력을 높이세요! 요즘 많은 기업에서 ChatGPT를 활용한 업무 자동화와 신사업 발굴이 빠르게 진행되고 있습니다. 이번 기회에 대기업 실무진(신사업/마케팅/재무/HR 등) 출신 7인의 전문가가 제작한 최대 50시간 VOD 강의를 메타코드 회원분들을 위해서 전액 무료 제공해 드리고 있습니다. [무료 / 200명 선착순] ChatGPT 활용 실무 챌린지 9기 모집 안내 https://metacodes.co.kr/edu/read2.nx?M2_IDX=30103&page=1&sc_is_discount=&sc_is_new=&EP_IDX=21451&EM_IDX=21261 ■ 참여 혜택 및 구성 실무에 바로 적용 가능한 ChatGPT 실습 강의 제공 총 50시간 중 20시간 내외 맞춤 선택 가능 온라인 2주 집중 과정 + 오프라인 네트워킹 1회 포함 업종별 실무별로 선택 가능한 교육 트랙 구성 ■ 주요 커리큘럼 예시 (택1~3) 신사업 개발: AI 기반 아이디어 발굴부터 시장 분석, 사업모델 수립까지 마케팅: SNS 콘텐츠 기획안 / 트렌드 리포트 자동 생성 데이터 자동화: Excel VBA + ChatGPT를 통한 보고서 자동화 금융 업무 자동화: 기업/상품 분석, 공모주 보고서 자동화 퀀트 투자 자동화: 전략 수립 → 백테스팅까지 한 번에 HR 업무 자동화: 채용/평가/보상 등 HR A to Z 실습 ■ 신청 절차 1단계) 사이트에서 무료 수강 신청 신청하기 링크 https://metacodes.co.kr/edu/read2.nx?M2_IDX=30103&page=1&sc_is_discount=&sc_is_new=&EP_IDX=21451&EM_IDX=21261 2단계) 신청자에게 문자로 발송되는 구글폼 작성※ 두 단계 모두 완료 시 신청 확정 -- -- 4차 산업 핵심 직군 교육 / 채용 플랫폼 MetaCode M 메타코드M 사이트 메타코드M, AI 교육 플랫폼 런칭 1년 만에 누적 수강생 5만 명 돌파 메타코드M_Youtube"
LAI_공지,[취업/알바/설명회] [서울경제진흥원] 청년취업사관학교 새싹(SeSAC) ‘커서AI 프론트엔드 부트캠프 교육생,2025.07.28,https://langai.hufs.ac.kr/bbs/langai/2090/232639/artclView.do,"안녕하세요. Language&AI융합학부 사무실입니다. 청년취업사관학교 새싹(SeSAC) 커서AI 프론트엔드 부트캠프 교육생 모집 안내 드립니다. 1. 과 정 명 : 커서AI 프론트엔드 부트캠프 2. 교육대상 : 개발자를 목표로 하는 누구나 (전공자, 비전공자 상관없음) 3. 모집기간 : 2025년 07월 21일(월) ~ 7월 30일(수) 4. 교육기간 및 교육시간 : - 교육기간 : 2025년 8월 4일 ~ 2026년 1월 16일 (5.5개월) - 교육시간 : 월~금 오전 10:00~18:00 5. 교육비 : 무료 (서울시 지원) 6. 교육장소 : 오프라인, 청년취업사관학교 강동캠퍼스 (5호선 강일역 바로 앞) 7. 교육생 혜택 : 점심 제공, 교육 과정과 수료 후에도 취업연계를 위한 '매칭데이' 진행 * 교육특징 : 25년 1월 수료생 기준 취업률 72% * 이벤트 : 홈페이지>자소서 완료 전원 스타벅스 쿠폰 증정, 친구 소개 상품권 지급 * 홈페이지 링크 : https://bit.ly/4k2h7x7"
LAI_공지,[기타] AI·디지털 네이티브 토론대회」및「AI·디지털 논문공모전」홍보,2025.07.24,https://langai.hufs.ac.kr/bbs/langai/2090/232594/artclView.do,"안녕하십니까? 과학기술정보통신부에서는 AI사회전환 주요 이슈에 대한 디지털 네이티브(청소년, 대학(원)생)의 관심과 이해도를 제고하고 소통역량 강화 등을 위해 「AI·디지털 네이티브 토론대회」 및 「AI·디지털 논문공모전」을 개최합니다. 토론대회는 중등부, 고등부, 대학부 등 3개 부문을 대상으로 하며, 우승자에게는 과학기술정보통신부 장관상 및 상금을 수여합니다. 논문공모전은 대학생 및 대학원생(개인 또는 3인 이내 공동연구 가능)을 대상으로 하며, 우수 논문 선발자에게 역시 과학기술정보통신부 장관상 및 상금을 수여합니다. 학생분들의 많은 참여를 부탁드립니다. <AI·디지털 네이티브 토론대회> ㅇ (모집기간) '25.07.21.(월) ~ '25.08.22.(금) 16시까지 ㅇ (지원자격) 3개 부문, 2인 1팀 구성 - (중등부) 중학교에 재학중이거나 2010년생부터 2012년생에 해당하는 자 - (고등부) 고등학교에 재학중이거나 2007년생부터 2009년생에 해당하는 자 - (대학부) 대학교 및 대학원 재학 또는 휴학 중인 자 ㅇ (토론주제) AI 기본사회에서 예상되는 사회적 이슈 및 쟁점 <토론대회(예선) 부문별 주제 및 논제> 구분 부문 공론화 주제 논제 예선 중등부 AI와 일자리 변화 ‣ AI 기술의 발전은 창작자·예술가의 직업적 가치를 위협하고 있는가? ‣ AI가 평가하고 관리하는 노동환경은 공정한가? 고등부 AI 알고리즘 편향성 ‣ AI 알고리즘의 투명성 강화가 필터버블 문제의 효과적 해법인가? ‣ 정보 다양성 보장과 사용 편의성, 무엇이 더 중요한가? 대학부 AI 환각(할루시네이션) ‣ 허위정보 우려 vs 창의적 상상력 허용, 어느 쪽이 사회에 이로운가? ‣ AI 환각(할루시네이션), 자율규제와 법적규제 중 어느 것이 효과적인가? ㅇ (시상내역) 과기정통부 장관상(3점), 기관장상(9점) 및 상금 총 1,120만원 - (중등부) · (과학기술정보통신부 장관상) 100만원(1팀) · (한국지능정보사회진흥원 원장상) 50만원(1팀) · (한국정보방송통신대연합 회장상) 30만원(2팀) - (고등부) · (과학기술정보통신부 장관상) 100만원(1팀) · (한국지능정보사회진흥원 원장상) 50만원(1팀) · (한국정보방송통신대연합 회장상) 30만원(2팀) - (대학부) · (과학기술정보통신부 장관상) 300만원(1팀) · (한국지능정보사회진흥원 원장상) 200만원(1팀) · (한국정보방송통신대연합 회장상) 100만원(2팀) ㅇ (신청방법) 디지털소사이어티 홈페이지(https://digitalsociety.or.kr/home)를 통한 온라인 접수 ㅇ (문의사항) 한국정보방송통신대연합 디지털정책협력본부(02-2132-2085, jaehoonko@kfict.or.kr) <AI·디지털 논문공모전> ㅇ (모집기간) '25.07.21.(월) ~ '25.09.26.(금) 16시까지 ㅇ (지원자격) 대학생 및 대학원생(휴학 및 졸업예정자 가능, 개인 또는 3인 이내의 공동연구 가능) ㅇ (논문주제) AI 기본사회에서 예상되는 사회적 이슈 및 쟁점해소를 위한 정책 방안 제시 - AI와 일자리 변화, AI 알고리즘 편향성, AI환각(할루시네이션) 등 ㅇ (시상내역) 과기정통부 장관상(1점), 기관장상(2점) 및 상금 총 700만원 - (과학기술정보통신부 장관상) 300만원(1점) - (한국지능정보사회진흥원 원장상) 200만원(1점) - (디지털소사이어티 의장상) 200만원(1점) ㅇ (신청방법) 디지털소사이어티 홈페이지(https://digitalsociety.or.kr/home)를 통한 온라인 접수 ㅇ (문의사항) 한국정보방송통신대연합 디지털정책협력본부(02-2132-2085, jaehoonko@kfict.or.k"
LAI_공지,[기타] [한국에듀테인먼트학회] 에듀테인먼트연구 제7권 2호 출간 및 논문 모집 안내,2025.07.18,https://langai.hufs.ac.kr/bbs/langai/2090/232459/artclView.do,"안녕하세요. Language&AI융합학부 사무실입니다. 에듀테인먼트연구 제7권 2호 출간 및 논문 모집 관련 안내 드립니다. 한국연구재단(KCI) 등재 학술지 한국에듀테인먼트학회의 에듀테인먼트연구 제7권 2호가 출간되었음을 안내 드립니다. 아래의 링크에서 논문 전체를 검색 및 다운로드 할 수 있습니다. - 한국에듀테인먼트학회 논문 검색 페이지 - 에듀테인먼트연구 논문 상시 모집 한국에듀테인먼트학회에서 발간하는 [에듀테인먼트연구]는 한국연구재단(KCI) 등재학술지입니다. 4차 산업시대를 선도하는 것은 그동안 지배적이었던 단일 학문 분야보다 융/복합을 통한 학문분야가 이끌어가야 합니다. 본 학회는 시대적 흐름에 적응하고, 이끌어가기 위한 기반을 착실히 다져가고 있습니다. [에듀테인먼트연구]의 원고 모집 요강 1. 에듀테인먼트는 융/복합 분야로서 특정 전공영역이 아니라 연구자분들의 관심사에서 교육적인 부분이 포함되면 투고 가능합니다. 권호 논문접수마감일 논문발간일 매년 1호 02월 28일 03월 30일 매년 2호 05월 31일 06월 30일 매년 3호 08월 31일 09월 30일 매년 4호 11월 30일 12월 30일 ※ 투고된 논문은 상시 심사되며, 투고일 기준 일반적으로 3주 이내에 심사 결과가 통보됩니다. ※ 발행횟수는 연간 4회 2. [투고 분야] - 본 학술지는 복합학 분야로서 모든 학문 영역에서 교육과 관련된 내용은 투고 가능합니다. - 본 학회에서 발간하는 에듀테인먼트연구는 복합학 영역이므로 학제간연구(전공이 다른 교수님 간의 연구)도 환영합니다. 3. [원고 모집 안내] - 투고자격 - 본 학회의 회원(회원 가입은 홈페이지). 본 학술지에 일반논문을 게재하고자 하는 자는 공동연구자를 포함하여, 본 학회의 회원으로 가입하셔야 합니다. - 온라인 투고 시 반드시 제1저자 비롯하여 공동저자가 있을 경우 모든 저자의 정보(주저자, 교신, 참여)를 입력하시기 바랍니다. - 학위논문을 기반으로 작성한 원고의 경우에는 학위수여자가 반드시 제1저자가 되어야 합니다. 석사논문, 박사학위 논문의 경우는 공동저자로서 지도교수나 실제 지도한 박사학위소지자를 공동저자로 할 수 있습니다. - 본 학회는 연구자분들을 배려하는 차원에서 논문투고를 하지 않으면 준회원으로서 회비를 납부하지 않으셔도 되며, 본 학회에서 발간하는 연구물을 무료로 다운 받을 수 있습니다. 4. 투고절차 : 온라인 홈페이지 제출 - 투고사이트 : http://www.koedus.com (공식홈페이지) - http://submission.koedus.com/Login (온라인논문투고) - 본 학회 논문투고시에는 한국연구재단KCI 문헌유사도 검사 결과를 첨부 요망 - 연구윤리 서약: 투고 전 학회 소개와 한국에듀테인먼트학회 윤리규정을 반드시 확인하고 논문 제출 시 윤리서약서에 동의(온라인)하시기 바랍니다. 5. <온라인 논문제출 참고사항> - 논문 작성 양식은 본 학회 홈페이지에 탑재되어 있으니 다운 받아 사용 - 논문투고 시에는 학회의 논문투고시스템에서 첨부해 드린 논문투고서, 저자점검표 등을 함께 제출 6. 심사료 및 게재료 논문 비고 일반논문 외부지원논문 심사료 7만원 - 인쇄분량 15쪽 - 기준 초과시 1쪽당 2만원 추가 게재료 15만원 별쇄본 5부 - 필요시 10부 추가(4만원) 납부계좌 농협 351-1090-0548-83 예금주: 한국에듀테인먼트학회 7. 문의 한국에듀테인먼트학회 사무국(043-299-8331) ○ 학회이메일 / (officekoedus@gmail.com) * 논문투고자는 온라인 논문투고시스템에 회원가입을 한번 더 하셔야 합니다. - http://submission.koedus.com/Login (온라인논문투고)"
LAI_공지,[기타] 2025 서초 AI · 로봇 공공서비스 공모전,2025.07.16,https://langai.hufs.ac.kr/bbs/langai/2090/232267/artclView.do,안녕하세요. Language&AI융합학부 사무실입니다. 2025 서초 AI·로봇 공공서비스 공모전 관련 안내 드립니다. (공지사항 링크)
LAI_공지,[장학] 교육혁신원 학부 근로장학생 모집 안내,2025.07.10,https://langai.hufs.ac.kr/bbs/langai/2090/232050/artclView.do,"안녕하세요. Language&AI융합학부 사무실입니다. 교육혁신원 학부 근로장학생 모집 관련 안내 드립니다. 모집공고, 지원서, 개인정보수집이용동의서는 첨부파일에 기재되어 있습니다. (공지사항 링크) 교육혁신원 학부 근로장학생 모집 교육혁신원은 우리 대학의 인재상에 부합하는 교과 교육과정 및 비교과 교육과정의 분석과 개선, 학생역량개발 등을 위한 연구 및 정책을 개발하고, 교육부 재정지원사업인 대학혁신지원사업을 운영하는 기관으로, 아래와 같이 함께할 학부생 근로장학생을 모집하오니 관심 있는 대학원생의 많은 지원 부탁드립니다. (교육혁신원 홈페이지: http://iei.hufs.ac.kr/) 1. 모집인원 : 학부 재학생 3명 2. 지원자격 가. 본교 학부 재학생(수료생, 휴학생, 졸업생 불가) 나. 등록금 범위 내 장학금 수혜 가능한 자 다. 서류 업무 처리에 어려움이 없는 자(한글, 엑셀, 파워포인트 등 활용) * 우대사항: 영상편집 가능자, 1년 이상 근무 가능자 우대 3. 주요업무 : 교육혁신원 SNS 채널 운영 담당, 사무 및 행사운영 보조(비교과 학습지원 프로그램 운영 지원) 4. 근무기간 : 2025년 2학기(6개월, 여름 방학 포함), 주중 8시간 이내 근무 *다른 근로장학생들과 함께 수업 시간 고려하여 근무 시간대 조정 5. 근무장소 : 서울캠퍼스 본관 303호 교육혁신원 혁신지원팀 6. 제출서류 및 방식 제출서류 : 지원서 1부(첨부파일 서식1), 개인정보활용동의서 1부(첨부파일 서식2) 제출방법 : 이메일 제출 (eac@hufs.ac.kr) 메일제목 예시 : 교육혁신원 근로장학생 지원 **학과 (학번), 김외대 7. 신청기한 : 2025년 8월 1일 (금) 오후 1시까지 (서류 접수 후 1주 내 면접 대상자들에게만 개별 연락 예정) 8. 장학금 : 지급금액 : 학기당 2,063,400원 (본인 등록금 내 장학금 지급가능) 지급일정 : 2025-2학기 중 일괄지급 주의사항 : 학자금 대출이 있거나 대출 예정인 경우, 본 장학금 지급 시 즉시 상환의무가 발생할 수 있으므로 지원 시 반드시 주의 요망 9. 문의 교육혁신원 혁신지원팀 eac@hufs.ac.kr, 02-2173-3965"
LAI_공지,[취업/알바/설명회] [메타코드] 온라인 현직자 무료 특강,2025.07.08,https://langai.hufs.ac.kr/bbs/langai/2090/231939/artclView.do,"안녕하세요. Language&AI융합학부 사무실입니다. 메타코드 무료 온라인 특강 안내 드립니다. <네이버 CLOVA 출신이 창업한 ""Sionic AI"" 출신 + 서울대병원 AX팀 출신> AX 현직자 온라인 무료 특강 초대합니다 단 40분 강의 + 20분 QnA! 전국 어디서나 참여 가능! AI 분야에서 근무하고 계신가요? AI 업계 취업을 준비 중이신가요? 6년차 활약 중인 AI Researcher에게 듣는 생생한 AX 분야 취업 가이드, 강의 개요 - 주최/주관: 대구시/대구디지털혁신진흥원 - 주제: AX 취업 및 경력 개발 가이드 - 강사: 윤도균 AI Researcher 현) 한국전자통신연구원(ETRI) AI Researcher 전) 서울대학교병원 AX팀 전) Sionic AI (네이버 클로바팀 출신이 창업한 AI 기업) - 일시: 2025년 7월 16일(수) 저녁 8시 ~ 9시 - 방식: Zoom 온라인 강의 - 내용: · 실무자가 말하는 AX 직무 및 역할 소개 · 포트폴리오 준비 방법 & 경력 개발 전략 · 실시간 QnA (20분) 포함 - 신청 링크: https://forms.gle/hyyMvz9eLtaozfpG7 누구나 참여 가능! (대구 시민 우선, 타지역도 참여 가능) AI/Data 커리어 전환·성장에 관심 있는 분 모두 환영 신청자에 한해 Zoom 링크 개별 안내 예정 많은 관심과 신청 부탁드립니다!"
